{
  "schema_version": "0.1.0",
  "titulo": "Ciclo XIX — Revisão autoral do atlas da Carcaça",
  "estado": "sem_aprovacao_autoral",
  "aprovacao_autoral": false,
  "mutacao_canonica_automatica": false,
  "fonte_manuscrito": "fontes/autoria/hack-carcaca-dw-capitulo-i.paginas.json",
  "dossies": [
    {
      "id": "worldbuilding-xix:dossie:xiv",
      "ciclo": "XIV",
      "arquivo": "data/worldbuilding/eldroth-ironwood-vandar-ciclo14.json",
      "estado": "em_revisao"
    },
    {
      "id": "worldbuilding-xix:dossie:xv",
      "ciclo": "XV",
      "arquivo": "data/worldbuilding/eldroth-preconquista-ciclo15.json",
      "estado": "em_revisao"
    },
    {
      "id": "worldbuilding-xix:dossie:xvi",
      "ciclo": "XVI",
      "arquivo": "data/worldbuilding/eldroth-ocupacao-sylara-ciclo16.json",
      "estado": "em_revisao"
    },
    {
      "id": "worldbuilding-xix:dossie:xvii",
      "ciclo": "XVII",
      "arquivo": "data/worldbuilding/vandar-politica-dos-mortos-ciclo17.json",
      "estado": "em_revisao"
    },
    {
      "id": "worldbuilding-xix:dossie:xviii",
      "ciclo": "XVIII",
      "arquivo": "data/worldbuilding/ironwood-sociedade-resistencia-ciclo18.json",
      "estado": "em_revisao"
    }
  ],
  "candidatos": [
    {
      "id": "worldbuilding-xix:candidato:001",
      "ciclo": "XIV",
      "referencia": {
        "arquivo": "data/worldbuilding/eldroth-ironwood-vandar-ciclo14.json",
        "colecao": "eixos",
        "id": "worldbuilding-xiv:eixo:ondas-feericas"
      },
      "indice_opcao": 0,
      "nome": "Cidadania pelas antigas alianças",
      "tipo": "alternativa",
      "estado": "nao_aprovado",
      "homologado": false
    },
    {
      "id": "worldbuilding-xix:candidato:002",
      "ciclo": "XIV",
      "referencia": {
        "arquivo": "data/worldbuilding/eldroth-ironwood-vandar-ciclo14.json",
        "colecao": "eixos",
        "id": "worldbuilding-xiv:eixo:ondas-feericas"
      },
      "indice_opcao": 1,
      "nome": "Pertencimento segundo comunidades locais",
      "tipo": "alternativa",
      "estado": "nao_aprovado",
      "homologado": false
    },
    {
      "id": "worldbuilding-xix:candidato:003",
      "ciclo": "XIV",
      "referencia": {
        "arquivo": "data/worldbuilding/eldroth-ironwood-vandar-ciclo14.json",
        "colecao": "eixos",
        "id": "worldbuilding-xiv:eixo:ondas-feericas"
      },
      "indice_opcao": 2,
      "nome": "Pertencimento contestado",
      "tipo": "alternativa",
      "estado": "nao_aprovado",
      "homologado": false
    },
    {
      "id": "worldbuilding-xix:candidato:004",
      "ciclo": "XIV",
      "referencia": {
        "arquivo": "data/worldbuilding/eldroth-ironwood-vandar-ciclo14.json",
        "colecao": "eixos",
        "id": "worldbuilding-xiv:eixo:regime-de-sylara"
      },
      "indice_opcao": 0,
      "nome": "Senhorios de exploração",
      "tipo": "alternativa",
      "estado": "nao_aprovado",
      "homologado": false
    },
    {
      "id": "worldbuilding-xix:candidato:005",
      "ciclo": "XIV",
      "referencia": {
        "arquivo": "data/worldbuilding/eldroth-ironwood-vandar-ciclo14.json",
        "colecao": "eixos",
        "id": "worldbuilding-xiv:eixo:regime-de-sylara"
      },
      "indice_opcao": 1,
      "nome": "Pactos de jurisdição",
      "tipo": "alternativa",
      "estado": "nao_aprovado",
      "homologado": false
    },
    {
      "id": "worldbuilding-xix:candidato:006",
      "ciclo": "XIV",
      "referencia": {
        "arquivo": "data/worldbuilding/eldroth-ironwood-vandar-ciclo14.json",
        "colecao": "eixos",
        "id": "worldbuilding-xiv:eixo:regime-de-sylara"
      },
      "indice_opcao": 2,
      "nome": "Zonas de exceção móvel",
      "tipo": "alternativa",
      "estado": "nao_aprovado",
      "homologado": false
    },
    {
      "id": "worldbuilding-xix:candidato:007",
      "ciclo": "XIV",
      "referencia": {
        "arquivo": "data/worldbuilding/eldroth-ironwood-vandar-ciclo14.json",
        "colecao": "eixos",
        "id": "worldbuilding-xiv:eixo:floresta-agente"
      },
      "indice_opcao": 0,
      "nome": "Coação ritual reversível",
      "tipo": "alternativa",
      "estado": "nao_aprovado",
      "homologado": false
    },
    {
      "id": "worldbuilding-xix:candidato:008",
      "ciclo": "XIV",
      "referencia": {
        "arquivo": "data/worldbuilding/eldroth-ironwood-vandar-ciclo14.json",
        "colecao": "eixos",
        "id": "worldbuilding-xiv:eixo:floresta-agente"
      },
      "indice_opcao": 1,
      "nome": "Ecossistemas desiguais",
      "tipo": "alternativa",
      "estado": "nao_aprovado",
      "homologado": false
    },
    {
      "id": "worldbuilding-xix:candidato:009",
      "ciclo": "XIV",
      "referencia": {
        "arquivo": "data/worldbuilding/eldroth-ironwood-vandar-ciclo14.json",
        "colecao": "eixos",
        "id": "worldbuilding-xiv:eixo:floresta-agente"
      },
      "indice_opcao": 2,
      "nome": "Alianças oportunistas",
      "tipo": "alternativa",
      "estado": "nao_aprovado",
      "homologado": false
    },
    {
      "id": "worldbuilding-xix:candidato:010",
      "ciclo": "XIV",
      "referencia": {
        "arquivo": "data/worldbuilding/eldroth-ironwood-vandar-ciclo14.json",
        "colecao": "eixos",
        "id": "worldbuilding-xiv:eixo:sagrado-druidico"
      },
      "indice_opcao": 0,
      "nome": "Conselhos de guardiões",
      "tipo": "alternativa",
      "estado": "nao_aprovado",
      "homologado": false
    },
    {
      "id": "worldbuilding-xix:candidato:011",
      "ciclo": "XIV",
      "referencia": {
        "arquivo": "data/worldbuilding/eldroth-ironwood-vandar-ciclo14.json",
        "colecao": "eixos",
        "id": "worldbuilding-xiv:eixo:sagrado-druidico"
      },
      "indice_opcao": 1,
      "nome": "Jurisdições sagradas",
      "tipo": "alternativa",
      "estado": "nao_aprovado",
      "homologado": false
    },
    {
      "id": "worldbuilding-xix:candidato:012",
      "ciclo": "XIV",
      "referencia": {
        "arquivo": "data/worldbuilding/eldroth-ironwood-vandar-ciclo14.json",
        "colecao": "eixos",
        "id": "worldbuilding-xiv:eixo:sagrado-druidico"
      },
      "indice_opcao": 2,
      "nome": "Negociações locais variáveis",
      "tipo": "alternativa",
      "estado": "nao_aprovado",
      "homologado": false
    },
    {
      "id": "worldbuilding-xix:candidato:013",
      "ciclo": "XIV",
      "referencia": {
        "arquivo": "data/worldbuilding/eldroth-ironwood-vandar-ciclo14.json",
        "colecao": "eixos",
        "id": "worldbuilding-xiv:eixo:cumplicidade-e-ruptura"
      },
      "indice_opcao": 0,
      "nome": "Justiça por testemunhos",
      "tipo": "alternativa",
      "estado": "nao_aprovado",
      "homologado": false
    },
    {
      "id": "worldbuilding-xix:candidato:014",
      "ciclo": "XIV",
      "referencia": {
        "arquivo": "data/worldbuilding/eldroth-ironwood-vandar-ciclo14.json",
        "colecao": "eixos",
        "id": "worldbuilding-xiv:eixo:cumplicidade-e-ruptura"
      },
      "indice_opcao": 1,
      "nome": "Anistia condicional",
      "tipo": "alternativa",
      "estado": "nao_aprovado",
      "homologado": false
    },
    {
      "id": "worldbuilding-xix:candidato:015",
      "ciclo": "XIV",
      "referencia": {
        "arquivo": "data/worldbuilding/eldroth-ironwood-vandar-ciclo14.json",
        "colecao": "eixos",
        "id": "worldbuilding-xiv:eixo:cumplicidade-e-ruptura"
      },
      "indice_opcao": 2,
      "nome": "Sem tribunal unificado",
      "tipo": "alternativa",
      "estado": "nao_aprovado",
      "homologado": false
    },
    {
      "id": "worldbuilding-xix:candidato:016",
      "ciclo": "XIV",
      "referencia": {
        "arquivo": "data/worldbuilding/eldroth-ironwood-vandar-ciclo14.json",
        "colecao": "eixos",
        "id": "worldbuilding-xiv:eixo:subsistencia"
      },
      "indice_opcao": 0,
      "nome": "Coleta sazonal comunitária",
      "tipo": "alternativa",
      "estado": "nao_aprovado",
      "homologado": false
    },
    {
      "id": "worldbuilding-xix:candidato:017",
      "ciclo": "XIV",
      "referencia": {
        "arquivo": "data/worldbuilding/eldroth-ironwood-vandar-ciclo14.json",
        "colecao": "eixos",
        "id": "worldbuilding-xiv:eixo:subsistencia"
      },
      "indice_opcao": 1,
      "nome": "Pequenos cultivos ocultos",
      "tipo": "alternativa",
      "estado": "nao_aprovado",
      "homologado": false
    },
    {
      "id": "worldbuilding-xix:candidato:018",
      "ciclo": "XIV",
      "referencia": {
        "arquivo": "data/worldbuilding/eldroth-ironwood-vandar-ciclo14.json",
        "colecao": "eixos",
        "id": "worldbuilding-xiv:eixo:subsistencia"
      },
      "indice_opcao": 2,
      "nome": "Trocas com territórios externos",
      "tipo": "alternativa",
      "estado": "nao_aprovado",
      "homologado": false
    },
    {
      "id": "worldbuilding-xix:candidato:019",
      "ciclo": "XIV",
      "referencia": {
        "arquivo": "data/worldbuilding/eldroth-ironwood-vandar-ciclo14.json",
        "colecao": "eixos",
        "id": "worldbuilding-xiv:eixo:refugiados"
      },
      "indice_opcao": 0,
      "nome": "Asilo por residência",
      "tipo": "alternativa",
      "estado": "nao_aprovado",
      "homologado": false
    },
    {
      "id": "worldbuilding-xix:candidato:020",
      "ciclo": "XIV",
      "referencia": {
        "arquivo": "data/worldbuilding/eldroth-ironwood-vandar-ciclo14.json",
        "colecao": "eixos",
        "id": "worldbuilding-xiv:eixo:refugiados"
      },
      "indice_opcao": 1,
      "nome": "Asilo por afinidade de tradição",
      "tipo": "alternativa",
      "estado": "nao_aprovado",
      "homologado": false
    },
    {
      "id": "worldbuilding-xix:candidato:021",
      "ciclo": "XIV",
      "referencia": {